{
  "schema_version": "1.0.0",
  "legacy_policy": "read-only-no-inference",
  "review_runs": [
    {
      "review_run_id": "A2-RUN-001",
      "review_series_id": "A2-SCHEMA-FREEZE",
      "review_scope": [
        "origin/main at e7a3ba13 -- the reported candidate b5e80832 did not exist"
      ],
      "subject_scope_digest": "b422ac967703dcd59c70c8e18adb0d5ed9ab8c37276863e4e5e9821f269bcbd2",
      "review_round": 1,
      "reviewer_identity": "Anthropic Claude (Claude Code), orchestrating reviewer for the A2 candidate",
      "coverage": [
        "reported commit resolution",
        "branch and PR existence",
        "main content"
      ],
      "unverified_surfaces": [
        "candidate content -- unreachable, nothing to review"
      ],
      "applicable_properties": [],
      "convergence_state": "NON-CONVERGED",
      "final_review": false,
      "round_budget_exhausted": false
    },
    {
      "review_run_id": "A2-RUN-002",
      "review_series_id": "A2-SCHEMA-FREEZE",
      "review_scope": [
        "A2 candidate at dae398a6"
      ],
      "subject_scope_digest": "5e1dd7fc8811a1b2eba91aa576c5c5222403c0e9fe2042524b17a917e65f439b",
      "review_round": 2,
      "reviewer_identity": "Anthropic Claude (Claude Code), orchestrating reviewer for the A2 candidate",
      "coverage": [
        "ten canonical schemas",
        "seven seed registries",
        "reference semantics",
        "IP-5 single control source",
        "stdlib constraint",
        "recorded test counts",
        "tracking-document chain"
      ],
      "unverified_surfaces": [
        "line-by-line reading of every validator branch"
      ],
      "applicable_properties": [],
      "convergence_state": "NON-CONVERGED",
      "final_review": false,
      "round_budget_exhausted": false
    },
    {
      "review_run_id": "A2-RUN-003",
      "review_series_id": "A2-SCHEMA-FREEZE",
      "review_scope": [
        "A2 candidate at 678f0f2"
      ],
      "subject_scope_digest": "77c1d54643b287bf7bd4b0b901e419e4ca02aaf370befe3db6b473ec487e2bd7",
      "review_round": 3,
      "reviewer_identity": "Anthropic Claude (Claude Code), orchestrating reviewer for the A2 candidate",
      "coverage": [
        "exception routing and authority boundary",
        "property transition and history",
        "review-ledger convergence and append-only",
        "baseline transitions",
        "proof artifact contract",
        "schema/semantics differential",
        "bounded validator keyword coverage"
      ],
      "unverified_surfaces": [
        "reviewer independence -- see the limitation recorded in the closure record",
        "field-by-field re-derivation of each schema against Governance §3.3/§7.1",
        "the A2-R3-001 fix itself, which post-dates this round's subject"
      ],
      "applicable_properties": [],
      "convergence_state": "IN_PROGRESS",
      "final_review": false,
      "round_budget_exhausted": false
    },
    {
      "review_run_id": "A2-RUN-004",
      "review_series_id": "A2-SCHEMA-FREEZE",
      "review_scope": [
        "A2 candidate at 11547d4 as pushed"
      ],
      "subject_scope_digest": "5d4daacd091c2afae57ff00d9c3f99ddff8a3a179654fb21f1f6b06e7fcc0bba",
      "review_round": 4,
      "reviewer_identity": "OpenAI ChatGPT, independent reviewer of the pushed 11547d4 candidate",
      "coverage": [
        "closure-gate self-certification sequencing",
        "digest proof strength",
        "phantom-stream negation regression coverage"
      ],
      "unverified_surfaces": [
        "re-derivation of the schema field sets",
        "the corrections this round produced, which post-date its subject"
      ],
      "applicable_properties": [],
      "convergence_state": "NON-CONVERGED",
      "final_review": false,
      "round_budget_exhausted": false
    },
    {
      "review_run_id": "A2-RUN-005",
      "review_series_id": "A2-SCHEMA-FREEZE",
      "review_scope": [
        "A2 candidate at 5ebc3f7 as pushed"
      ],
      "subject_scope_digest": "906ce9559f961f3d4a91cce89ea03cd45c1bc03945093611e8d4ace9f9dd1ad6",
      "review_round": 5,
      "reviewer_identity": "OpenAI ChatGPT, independent reviewer of the pushed 5ebc3f7 candidate",
      "coverage": [
        "historical-digest verification completeness",
        "ledger provenance timestamps",
        "governance citation accuracy",
        "review-round digest invariants"
      ],
      "unverified_surfaces": [
        "the corrections this round produced, which post-date its subject"
      ],
      "applicable_properties": [],
      "convergence_state": "NON-CONVERGED",
      "final_review": false,
      "round_budget_exhausted": false
    },
    {
      "review_run_id": "A2-RUN-006",
      "review_series_id": "A2-SCHEMA-FREEZE",
      "review_scope": [
        "A2 candidate at 7d4e949 as pushed"
      ],
      "subject_scope_digest": "deb9bf31d14d4f89615a6f8d85b78a3ba2e55506f80857371e2f2249ed40d59c",
      "review_round": 6,
      "reviewer_identity": "OpenAI ChatGPT, independent reviewer of the pushed 7d4e949 candidate",
      "coverage": [
        "ledger provenance semantics",
        "status-timestamp regression strength"
      ],
      "unverified_surfaces": [
        "the corrections this round produced, which post-date its subject"
      ],
      "applicable_properties": [],
      "convergence_state": "NON-CONVERGED",
      "final_review": false,
      "round_budget_exhausted": false
    },
    {
      "review_run_id": "A2-RUN-007",
      "review_series_id": "A2-SCHEMA-FREEZE",
      "review_scope": [
        "A2 candidate at c349fb6 as pushed"
      ],
      "subject_scope_digest": "93f97569ad987a5d8c9f68453ea7d973485f32e560128a8323fcafa17d1b1559",
      "review_round": 7,
      "reviewer_identity": "OpenAI ChatGPT, independent reviewer of the pushed c349fb6 candidate",
      "coverage": [
        "status-timestamp provenance model and its regression"
      ],
      "unverified_surfaces": [
        "the correction this round produced, which post-dates its subject"
      ],
      "applicable_properties": [],
      "convergence_state": "NON-CONVERGED",
      "final_review": false,
      "round_budget_exhausted": false
    },
    {
      "review_run_id": "A2-RUN-008",
      "review_series_id": "A2-SCHEMA-FREEZE",
      "review_scope": [
        "A2 candidate at a034fc3 as pushed on pull request #347"
      ],
      "subject_scope_digest": "a39f24d29a7057d1ea03ff68738b3eec15186d176de0924d6a58d3cd34c6994a",
      "review_round": 8,
      "reviewer_identity": "chatgpt-codex-connector, automated review on pull request #347",
      "coverage": [
        "activation-baseline anti-ratchet",
        "proof execution subject binding",
        "intentionally-disabled anchor validation"
      ],
      "unverified_surfaces": [
        "the corrections this round produced, which post-date its subject"
      ],
      "applicable_properties": [],
      "convergence_state": "NON-CONVERGED",
      "final_review": false,
      "round_budget_exhausted": false
    },
    {
      "review_run_id": "A2-RUN-009",
      "review_series_id": "A2-SCHEMA-FREEZE",
      "review_scope": [
        "A2 candidate at c927a95 as pushed on pull request #347",
        "Verification pass over the round-8 corrections and their recorded evidence"
      ],
      "subject_scope_digest": "34d1d26a9dfab78001b52886a1345dad4e37f9fcf76d89f7b617148eb5d6fa6e",
      "review_round": 9,
      "reviewer_identity": "Anthropic Claude (Claude Code), separate session; NOT independent of the round-8 remediation, which the same assistant produced",
      "coverage": [
        "activation-baseline mode transitions against the declared transition table",
        "proof execution subject binding, re-derived from the plan's field definition",
        "disable-anchor single-owner validation and its differential fixtures",
        "round-7/8 timestamp binding recomputed against git commit times",
        "the four repository gates re-run against the pushed head",
        "document header/version-history agreement across the governance set"
      ],
      "unverified_surfaces": [
        "the corrections this round produced, which post-date its subject",
        "a field-by-field re-derivation of each schema against Governance 3.3 and 7.1"
      ],
      "applicable_properties": [],
      "convergence_state": "NON-CONVERGED",
      "final_review": false,
      "round_budget_exhausted": false
    }
  ],
  "findings": [
    {
      "finding_id": "A2-R1-001",
      "stable_key": "a2/r1-001",
      "review_series_id": "A2-SCHEMA-FREEZE",
      "parent_review_run_id": "A2-RUN-001",
      "summary": "The reported A2 candidate did not exist in the repository.",
      "evidence": [
        "git cat-file, the GitHub commit API, ls-remote over all 353 refs, and the PR list all failed to resolve b5e80832 or codex/a2-complete-schema-freeze; main carried no JSON schema of any kind."
      ],
      "severity": "Critical",
      "requirement_property": [
        "Governance FR-AG-018 (a fresh review is over the CURRENT artifact)",
        "integration-plan §11 A2"
      ],
      "disposition": "Blocker",
      "required_action": "Fix",
      "owner": "A2 review",
      "status": "Resolved",
      "round_introduced": 1,
      "resolution_evidence": [
        "The branch was published; review round 2 was performed over dae398a6."
      ],
      "status_history": [
        {
          "event_id": "A2-R1-001-E1",
          "transition_from": null,
          "transition_to": "Open",
          "actor": "Anthropic Claude (Claude Code), orchestrating reviewer for the A2 candidate",
          "at": "2026-09-01T19:24:32Z",
          "evidence": [
            "git cat-file, the GitHub commit API, ls-remote over all 353 refs, and the PR list all failed to resolve b5e80832 or codex/a2-complete-schema-freeze; main carried no JSON schema of any kind.",